{
  "$schema": "https://json-schema.org/draft/2020-12/schema",
  "$id": "urn:dumbmoney:schema:research-mesh-runner-config:v1",
  "title": "DumbMoney Research Mesh public runner configuration",
  "type": "object",
  "additionalProperties": false,
  "required": [
    "schema",
    "data_root",
    "candidate_inbox",
    "allocation_inbox",
    "readiness_path",
    "research_mesh_public_key_path",
    "allocator_public_key_path",
    "core_public_key_path",
    "core_readiness_path",
    "model_request_inbox",
    "model_response_outbox",
    "model_outcome_outbox",
    "model_gateway_readiness_path",
    "model_gateway_public_key_path",
    "fund_lock_path",
    "service_manifest_path",
    "bind_port",
    "release_id",
    "research_mesh_public_key_sha256",
    "allocator_public_key_sha256",
    "core_public_key_sha256",
    "model_gateway_public_key_sha256",
    "model_gateway_runner_config_sha256",
    "fund_lock_sha256",
    "service_manifest_sha256",
    "readiness_ttl_seconds",
    "processing_interval_milliseconds",
    "core_timeout_seconds",
    "model_gateway_timeout_seconds",
    "max_input_bytes",
    "model_request_max_bytes",
    "model_response_max_bytes",
    "model_prompt_max_characters",
    "model_max_output_tokens",
    "model_max_reserve_microusd",
    "credential_targets"
  ],
  "properties": {
    "schema": {
      "const": "dumbmoney.research-mesh-runner-config.v1"
    },
    "data_root": {
      "$ref": "#/$defs/absoluteWindowsPath"
    },
    "candidate_inbox": {
      "$ref": "#/$defs/absoluteWindowsPath"
    },
    "allocation_inbox": {
      "$ref": "#/$defs/absoluteWindowsPath"
    },
    "readiness_path": {
      "$ref": "#/$defs/absoluteWindowsPath"
    },
    "research_mesh_public_key_path": {
      "$ref": "#/$defs/absoluteWindowsPath"
    },
    "allocator_public_key_path": {
      "$ref": "#/$defs/absoluteWindowsPath"
    },
    "core_public_key_path": {
      "$ref": "#/$defs/absoluteWindowsPath"
    },
    "core_readiness_path": {
      "$ref": "#/$defs/absoluteWindowsPath"
    },
    "model_request_inbox": {
      "const": "C:\\ProgramData\\DumbMoney\\spool\\model\\requests"
    },
    "model_response_outbox": {
      "const": "C:\\ProgramData\\DumbMoney\\spool\\model\\responses"
    },
    "model_outcome_outbox": {
      "const": "C:\\ProgramData\\DumbMoney\\spool\\model\\outcomes"
    },
    "model_gateway_readiness_path": {
      "const": "C:\\ProgramData\\DumbMoney\\readiness\\DumbMoneyModelGateway.json"
    },
    "model_gateway_public_key_path": {
      "const": "C:\\ProgramData\\DumbMoney\\model-gateway\\keys\\gateway-ed25519.pub"
    },
    "fund_lock_path": {
      "$ref": "#/$defs/absoluteWindowsPath"
    },
    "service_manifest_path": {
      "$ref": "#/$defs/absoluteWindowsPath"
    },
    "bind_port": {
      "type": "integer",
      "minimum": 0,
      "maximum": 65535
    },
    "release_id": {
      "type": "string",
      "minLength": 1,
      "maxLength": 128
    },
    "research_mesh_public_key_sha256": {
      "$ref": "#/$defs/sha256"
    },
    "allocator_public_key_sha256": {
      "$ref": "#/$defs/sha256"
    },
    "core_public_key_sha256": {
      "$ref": "#/$defs/sha256"
    },
    "model_gateway_public_key_sha256": {
      "$ref": "#/$defs/sha256"
    },
    "model_gateway_runner_config_sha256": {
      "$ref": "#/$defs/sha256"
    },
    "fund_lock_sha256": {
      "$ref": "#/$defs/sha256"
    },
    "service_manifest_sha256": {
      "$ref": "#/$defs/sha256"
    },
    "readiness_ttl_seconds": {
      "type": "integer",
      "minimum": 10,
      "maximum": 120
    },
    "processing_interval_milliseconds": {
      "type": "integer",
      "minimum": 100,
      "maximum": 60000
    },
    "core_timeout_seconds": {
      "type": "integer",
      "minimum": 1,
      "maximum": 30
    },
    "model_gateway_timeout_seconds": {
      "const": 10
    },
    "max_input_bytes": {
      "type": "integer",
      "minimum": 4096,
      "maximum": 16777216
    },
    "model_request_max_bytes": {
      "const": 1048576
    },
    "model_response_max_bytes": {
      "const": 1000000
    },
    "model_prompt_max_characters": {
      "const": 100000
    },
    "model_max_output_tokens": {
      "const": 1024
    },
    "model_max_reserve_microusd": {
      "const": 6000000
    },
    "credential_targets": {
      "type": "object",
      "additionalProperties": false,
      "required": [
        "research_mesh_signing_seed",
        "allocator_signing_seed",
        "allocator_bearer_token",
        "model_gateway_client_token"
      ],
      "properties": {
        "research_mesh_signing_seed": {
          "const": "credential-target:DumbMoney/ResearchMeshSigner"
        },
        "allocator_signing_seed": {
          "const": "credential-target:DumbMoney/ResearchMeshAllocator"
        },
        "allocator_bearer_token": {
          "const": "credential-target:DumbMoney/AllocatorToken"
        },
        "model_gateway_client_token": {
          "const": "credential-target:DumbMoney/ModelGatewayClientToken"
        }
      }
    }
  },
  "$defs": {
    "absoluteWindowsPath": {
      "type": "string",
      "pattern": "^[A-Za-z]:\\\\"
    },
    "sha256": {
      "type": "string",
      "pattern": "^[0-9a-f]{64}$"
    }
  }
}
