{
  "schema": "dumbmoney.research-mesh-runner-config.v1",
  "data_root": "C:\\ProgramData\\DumbMoney\\research",
  "candidate_inbox": "C:\\ProgramData\\DumbMoney\\research\\candidate-inbox",
  "allocation_inbox": "C:\\ProgramData\\DumbMoney\\research\\allocation-inbox",
  "readiness_path": "C:\\ProgramData\\DumbMoney\\readiness\\DumbMoneyResearchMesh.json",
  "research_mesh_public_key_path": "C:\\ProgramData\\DumbMoney\\research\\keys\\research-mesh-ed25519.pub",
  "allocator_public_key_path": "C:\\ProgramData\\DumbMoney\\research\\keys\\allocator-ed25519.pub",
  "core_public_key_path": "C:\\ProgramData\\DumbMoney\\core\\keys\\core-ed25519.pub",
  "core_readiness_path": "C:\\ProgramData\\DumbMoney\\readiness\\DumbMoneyCore.json",
  "model_request_inbox": "C:\\ProgramData\\DumbMoney\\spool\\model\\requests",
  "model_response_outbox": "C:\\ProgramData\\DumbMoney\\spool\\model\\responses",
  "model_outcome_outbox": "C:\\ProgramData\\DumbMoney\\spool\\model\\outcomes",
  "model_gateway_readiness_path": "C:\\ProgramData\\DumbMoney\\readiness\\DumbMoneyModelGateway.json",
  "model_gateway_public_key_path": "C:\\ProgramData\\DumbMoney\\model-gateway\\keys\\gateway-ed25519.pub",
  "fund_lock_path": "C:\\Program Files\\DumbMoney\\releases\\TO_BE_RESOLVED\\fund.lock.json",
  "service_manifest_path": "C:\\Program Files\\DumbMoney\\releases\\TO_BE_RESOLVED\\services.v1.json",
  "bind_port": 8787,
  "release_id": "TO_BE_RESOLVED",
  "research_mesh_public_key_sha256": "0000000000000000000000000000000000000000000000000000000000000000",
  "allocator_public_key_sha256": "0000000000000000000000000000000000000000000000000000000000000000",
  "core_public_key_sha256": "0000000000000000000000000000000000000000000000000000000000000000",
  "model_gateway_public_key_sha256": "0000000000000000000000000000000000000000000000000000000000000000",
  "model_gateway_runner_config_sha256": "0000000000000000000000000000000000000000000000000000000000000000",
  "fund_lock_sha256": "0000000000000000000000000000000000000000000000000000000000000000",
  "service_manifest_sha256": "0000000000000000000000000000000000000000000000000000000000000000",
  "readiness_ttl_seconds": 90,
  "processing_interval_milliseconds": 1000,
  "core_timeout_seconds": 5,
  "model_gateway_timeout_seconds": 10,
  "max_input_bytes": 1048576,
  "model_request_max_bytes": 1048576,
  "model_response_max_bytes": 1000000,
  "model_prompt_max_characters": 100000,
  "model_max_output_tokens": 1024,
  "model_max_reserve_microusd": 6000000,
  "credential_targets": {
    "research_mesh_signing_seed": "credential-target:DumbMoney/ResearchMeshSigner",
    "allocator_signing_seed": "credential-target:DumbMoney/ResearchMeshAllocator",
    "allocator_bearer_token": "credential-target:DumbMoney/AllocatorToken",
    "model_gateway_client_token": "credential-target:DumbMoney/ModelGatewayClientToken"
  }
}
